{
  "equip_id": 421,
  "item": "shincolle_kai:equip_machinegun",
  "variant": 4,
  "equip_type": "gun_hi",
  "compatible": [
    "cannon",
    "aircraft"
  ],
  "enchant_type": "weapon",
  "develop": {
    "material": "ammo",
    "amount": 800,
    "rare_mean": 1000
  },
  "roll_type": 21,
  "stats": {
    "shincolle_kai:mov": -0.05,
    "shincolle_kai:cri": 0.01,
    "shincolle_kai:aa": 35.0
  }
}
