{
  "equip_id": 329,
  "item": "shincolle:equip_ammo",
  "variant": 3,
  "equip_type": "ammo_hi",
  "compatible": [
    "cannon",
    "aircraft"
  ],
  "enchant_type": "weapon",
  "develop": {
    "material": "ammo",
    "amount": 1000,
    "rare_mean": 2000
  },
  "roll_type": 29,
  "stats": {
    "shincolle:atk_l": 4.0,
    "shincolle:atk_al": 4.0,
    "shincolle:mov": -0.04,
    "shincolle:hit": 4.0,
    "shincolle:miss": 0.1,
    "shincolle:aa": 60.0,
    "shincolle:ammo": 0.15
  }
}
