{
  "equip_id": 2109,
  "item": "shincolle_kai:equip_airplane",
  "variant": 21,
  "equip_type": "air_f_hi",
  "compatible": [
    "aircraft"
  ],
  "enchant_type": "weapon",
  "develop": {
    "material": "abyss_metal_1",
    "amount": 3800,
    "rare_mean": 4000
  },
  "roll_type": 9,
  "stats": {
    "shincolle_kai:atk_al": 24.0,
    "shincolle_kai:spd": 0.12,
    "shincolle_kai:mov": -0.32,
    "shincolle_kai:hit": 5.5,
    "shincolle_kai:miss": 0.04,
    "shincolle_kai:aa": 120.0
  }
}
