{
  "equip_id": 14,
  "item": "shincolle_kai:equip_radar",
  "variant": 0,
  "equip_type": "radar_lo",
  "compatible": [
    "cannon",
    "aircraft"
  ],
  "enchant_type": "misc",
  "develop": {
    "material": "grudge",
    "amount": 200,
    "rare_mean": 1000
  },
  "roll_type": 14,
  "stats": {
    "shincolle_kai:atk_l": 2.0,
    "shincolle_kai:atk_al": 3.0,
    "shincolle_kai:def": 0.03,
    "shincolle_kai:mov": -0.08,
    "shincolle_kai:hit": 1.0,
    "shincolle_kai:miss": 0.05,
    "shincolle_kai:aa": 12.0,
    "shincolle_kai:dodge": 0.02
  }
}
