{
  "equip_id": 318,
  "item": "shincolle:equip_armor",
  "variant": 3,
  "equip_type": "armor_lo",
  "compatible": [
    "cannon",
    "aircraft"
  ],
  "enchant_type": "armor",
  "develop": {
    "material": "abyss_metal",
    "amount": 80,
    "rare_mean": 3000
  },
  "roll_type": 18,
  "stats": {
    "shincolle:hp": 260.0,
    "shincolle:def": 0.03,
    "shincolle:mov": -0.14,
    "shincolle:dodge": 0.06,
    "shincolle:hpres": 0.15,
    "shincolle:kb": 0.12
  }
}
