{
  "equip_id": 401,
  "item": "shincolle:equip_cannon",
  "variant": 4,
  "equip_type": "cannon_tw_lo",
  "compatible": [
    "cannon"
  ],
  "enchant_type": "weapon",
  "develop": {
    "material": "ammo",
    "amount": 320,
    "rare_mean": 3200
  },
  "roll_type": 1,
  "stats": {
    "shincolle:atk_l": 5.0,
    "shincolle:spd": 0.25,
    "shincolle:mov": -0.12,
    "shincolle:hit": 1.0,
    "shincolle:dhit": 0.06,
    "shincolle:aa": 20.0,
    "shincolle:ammo": 0.2
  }
}
