{
  "equip_id": 206,
  "item": "shincolle:equip_airplane",
  "variant": 2,
  "equip_type": "air_t_lo",
  "compatible": [
    "aircraft"
  ],
  "enchant_type": "weapon",
  "develop": {
    "material": "abyss_metal_1",
    "amount": 2400,
    "rare_mean": 4000
  },
  "roll_type": 6,
  "stats": {
    "shincolle:atk_al": 7.0,
    "shincolle:atk_ah": 28.0,
    "shincolle:mov": -0.18,
    "shincolle:hit": 2.5,
    "shincolle:aa": 9.0,
    "shincolle:asm": 24.0
  }
}
