{
  "equip_id": 217,
  "item": "shincolle_kai:equip_turbine",
  "variant": 2,
  "equip_type": "turbine_hi",
  "compatible": [
    "cannon",
    "aircraft"
  ],
  "enchant_type": "misc",
  "develop": {
    "material": "grudge",
    "amount": 3200,
    "rare_mean": 2000
  },
  "roll_type": 17,
  "stats": {
    "shincolle_kai:mov": 0.2,
    "shincolle_kai:dodge": 0.1,
    "shincolle_kai:grudge": 0.4
  }
}
