{
  "equip_id": 214,
  "item": "shincolle:equip_radar",
  "variant": 2,
  "equip_type": "radar_lo",
  "compatible": [
    "cannon",
    "aircraft"
  ],
  "enchant_type": "misc",
  "develop": {
    "material": "grudge",
    "amount": 200,
    "rare_mean": 2600
  },
  "roll_type": 14,
  "stats": {
    "shincolle:atk_l": 2.0,
    "shincolle:atk_h": 3.0,
    "shincolle:atk_al": 3.0,
    "shincolle:atk_ah": 4.0,
    "shincolle:def": 0.03,
    "shincolle:mov": -0.08,
    "shincolle:hit": 1.0,
    "shincolle:miss": 0.05,
    "shincolle:dodge": 0.02
  }
}
