{
  "equip_id": 621,
  "item": "shincolle_kai:equip_machinegun",
  "variant": 6,
  "equip_type": "gun_hi",
  "compatible": [
    "cannon",
    "aircraft"
  ],
  "enchant_type": "weapon",
  "develop": {
    "material": "ammo",
    "amount": 800,
    "rare_mean": 4000
  },
  "roll_type": 21,
  "stats": {
    "shincolle_kai:atk_l": 3.0,
    "shincolle_kai:mov": -0.1,
    "shincolle_kai:hit": 2.0,
    "shincolle_kai:cri": 0.04,
    "shincolle_kai:miss": 0.06,
    "shincolle_kai:aa": 65.0
  }
}
