{
  "equip_id": 24,
  "item": "shincolle_kai:equip_drum",
  "variant": 0,
  "equip_type": "drum_lo",
  "compatible": [
    "cannon",
    "aircraft"
  ],
  "enchant_type": "misc",
  "develop": {
    "material": "abyss_metal",
    "amount": 120,
    "rare_mean": 2000
  },
  "roll_type": 24,
  "stats": {
    "shincolle_kai:mov": -0.25,
    "shincolle_kai:xp": 0.5,
    "shincolle_kai:hpres": 0.15
  }
}
