{
  "equip_id": 715,
  "item": "shincolle_kai:equip_radar",
  "variant": 7,
  "equip_type": "radar_hi",
  "compatible": [
    "cannon",
    "aircraft"
  ],
  "enchant_type": "misc",
  "develop": {
    "material": "grudge",
    "amount": 2000,
    "rare_mean": 3200
  },
  "roll_type": 15,
  "stats": {
    "shincolle_kai:atk_h": 9.0,
    "shincolle_kai:atk_ah": 9.0,
    "shincolle_kai:def": 0.06,
    "shincolle_kai:mov": -0.08,
    "shincolle_kai:hit": 1.0,
    "shincolle_kai:cri": 0.04,
    "shincolle_kai:miss": 0.1,
    "shincolle_kai:asm": 32.0,
    "shincolle_kai:dodge": 0.04
  }
}
