{
  "equip_id": 505,
  "item": "shincolle:equip_torpedo",
  "variant": 5,
  "equip_type": "torpedo_hi",
  "compatible": [
    "cannon"
  ],
  "enchant_type": "weapon",
  "develop": {
    "material": "ammo",
    "amount": 1200,
    "rare_mean": 3600
  },
  "roll_type": 5,
  "stats": {
    "shincolle:atk_h": 40.0,
    "shincolle:spd": 0.18,
    "shincolle:mov": -0.3,
    "shincolle:hit": 1.6,
    "shincolle:cri": 0.15,
    "shincolle:miss": 0.06,
    "shincolle:asm": 45.0,
    "shincolle:ammo": 0.3
  }
}
